{"schema":"geometry.step_topology.apply_hierarchy.request.a0","session":{"session_handle":"gts_1111111111111111111111111111111111111111111111111111111111111111","generation":9},"expected_hierarchy_revision":0,"commands":[{"kind":"create_product","authored_id":"wn.geometer.research.product.UpperCase","name":"Box","source_kind":"definition","source_handle":"gtt_2222222222222222222222222222222222222222222222222222222222222222"},{"kind":"create_assembly","authored_id":"wn.geometer.research.assembly.root","name":"Root"},{"kind":"create_occurrence","authored_id":"wn.geometer.research.occurrence.box","child_authored_id":"wn.geometer.research.product.UpperCase","parent_assembly_authored_id":"wn.geometer.research.assembly.root","transform":[1,0,0,0,0,1,0,0,0,0,1,0]}]}